{"append_count":1,"appended_selectors":["PYPI_UPLOAD_SET_OBSERVED"],"batch_sha256":"sha256:3333333333333333333333333333333333333333333333333333333333333333","classification":"PARTIAL_EXACT","first_receipt_id":"sha256:4444444444444444444444444444444444444444444444444444444444444444","first_receipt_sha256":"sha256:3333333333333333333333333333333333333333333333333333333333333333","first_sequence":18,"head_receipt_id":"sha256:1111111111111111111111111111111111111111111111111111111111111111","head_receipt_sha256":"sha256:2222222222222222222222222222222222222222222222222222222222222222","head_sequence":18,"release_identity_id":"sha256:3d52af3a2bc6eb185a48465c8680d988a57f7fecf668313673ded1aaed3a59ab","resulting_state":"RECOVERY_REQUIRED","schema":"dpone.release-controller-pypi-outcome-response.v1","schema_version":1,"tag":"v0.74.0","verified_file_count":0}